<?xml version="1.0" encoding="UTF-8"?>

<xs:schema xmlns:xs="http://www.w3.org/2001/XMLSchema"
           targetNamespace="http://nure.ua/your_last_name/practice7">
    <xs:element name="Users">
        <xs:complexType>
            <xs:sequence>
                <xs:element maxOccurs="unbounded" name="User">
                    <xs:complexType>
                        <xs:sequence>
                            <xs:element type="xs:string" name="Name"/>
                            <xs:element type="xs:integer" name="Age"/>
                            <xs:element name="City">
                                <xs:simpleType>
                                    <xs:restriction base="xs:string">
                                        <xs:enumeration value="LVIV"/>
                                        <xs:enumeration value="DNIPRO"/>
                                        <xs:enumeration value="KUIV"/>
                                    </xs:restriction>
                                </xs:simpleType>
                            </xs:element>
                            <xs:element type="xs:string" name="Surname"/>
                        </xs:sequence>
                    </xs:complexType>
                </xs:element>
            </xs:sequence>
        </xs:complexType>
    </xs:element>
</xs:schema>
